,url,content
19,http://v.media.daum.net/v/20210415162226268,"(지디넷코리아=김익현 미디어연구소장)인공지능(AI)과 사물인터넷, 그리고 빅데이터가 세상을 바꾸고 있다. 전통적인 산업사회에서 명실상부한 지능정보화 사회로 진화하고 있다. 이런 변화는 최근 미국을 대표하는 기업들의 면면만 살펴봐도 쉽게 알 수 있다. 최근 미국 시가총액 상위 5개 기업은 애플, 알파벳(구글), 마이크로소프트, 아마존, 그리고 페이스북이다. 이들은 모두 인공지능과 데이터 분석에 강점을 갖고 있는 ICT 기반 플랫폼들이다. 지금 우리 사회는 지능화된 기계가 인간의 노동력을 대체하고 고부가가치를 창출하는 시대의 문턱에 서 있다. 이처럼 인간의 노동과 지능이 도전 받는 시대에 인간이 설 자리는 어디일까? 인간은 인공지능을 어떻게 받아들여야 할까? 또 인공지능과 인간이 ‘행복한 공존’을 할 수 있는 방법은 없을까? ‘AI의 도전’은 이런 묵직한 질문들을 다루고 있는 책이다. 사회과학자이자 국내 대표적인 ICT 정책 전문가인 저자 현대원 교수는 새롭게 다가오는 ‘초지능의 물결’을 이론적으로 분석함과 동시에 산업적 측면에서의 변화, 미래의 직업인이 대비해야 할 것들에 대해서도 다각적으로 검토한다. 이 책에서 저자는 인공지능, 사물인터넷, 그리고 빅데이터가 세상을 어떻게 바꾸어 나가고 있는지 세심하게 톺아본다. 이를 위해 자율주행차, 블록체인 기술, 스마트 팩토리 등의 구체적인 산업 사례들을 들어 설명하고 있다. 이 과정에서 저자가 특히 강조하는 것은 교육이다. 노동 시장 수요가 급변함에 따라 창의성과 도전적 창업정신이 중심이 되는 새로운 교육 패러다임이 필요함을 강조한다. 인공지능, 로봇과 인간의 행복한 공존 문제도 21세기의 중요한 화두 중 하나다. 이에 대해 저자는 인공지능ㆍ로봇이 잘할 수 있는 부분과 인간과 함께 협업해야 하는 부분, 그리고 여전히 인간의 영향력과 기여가 큰 부분 등을 잘 고려해서 산업 전반의 구조조정과 관련된 법제도 정비, 재교육을 통한 기존 근로자들의 재배치 등이 필요하다고 강조한다. 이와 함께 사회안전망 구축에 이르기까지 체계적으로 대비할 필요가 있다고 제언하고 있다. 이 책은 총 4부로 구성돼 있다. 1부는 새로운 도전의 시작에 대해 다룬다. 초연결에서 초지능으로 진화하는 사회적인 동향을 살펴보고, 이런 패러다임 변화가 인간의 지능에 어떻게 도전하는지 탐구한다. 2부에선 AI의 도전과 변화를 추동하는 인공지능, 사물인터넷, 빅데이터 3대 엔진에 대해 살펴본다. ‘기회 그리고 미래’를 다루는 3부에서는 인공지능과 빅데이터 그리고 초연결 네트워크가 만들어 내는 새로운 산업들을 살펴본다. 저자는 자율주행차, 핀테크, 블록체인, 가상현실 등 초지능 사회를 이끄는 대표적인 분야에 대해 살펴본다. 이와 함께 독일을 중심으로 진행된 스마트팩토리 혁신도 다루고 있다. 아이다스 등이 선도적으로 시도한 스마트팩토리는 인공지능과 빅데이터 그리고 사물인터넷의 조화로운 협업의 산물이다. 4부에서는 생산현장에 인간이 보이지 않고 인간 노동의 가치가 0에 수렴함에 따라 산업구조와 노동구조가 바뀌고, 이는 곧 산업현장의 심각한 구조조정과 함께 정부 고용복지 정책의 전면적 수정으로 이어지는 큰 변화를 강조한다. 그리고 이러한 상황에 대한 우리의 전략적 대응방안들에 대해서도 다각도로 검토한다. 저자인 현대원 교수는 청와대 미래전략수석을 역임하는 등 지난 20여 년간 우리나라의 대표적인 ICT 정책 전문가로 활동해 왔다. 인공지능의 위협과 공존, 그리고 기회를 다룬 이 책엔 저자의 이런 경험이 잘 녹아들어 있다. (현대원 지음/ 나남, 2만원) 김익현 미디어연구소장(sini@zdnet.co.kr) ©메가뉴스 & ZDNET, A RED VENTURES COMPANY, 무단전재-재배포 금지"
20,http://v.media.daum.net/v/20210413120033657,"[서울=뉴시스] 여성가족부(여가부)는 13일 오후 대전 한국과학기술원에서 인공지능(AI) 분야 양성평등 정책 확산을 주제로 토론회를 개최했다. (사진=뉴시스 DB) 2018.11.22. photo@newsis.com [서울=뉴시스] 구무서 기자 = 여성가족부(여가부)는 13일 오후 대전 한국과학기술원에서 인공지능(AI) 분야 양성평등 정책 확산을 주제로 토론회를 개최했다. 이번 토론회는 최근 AI 챗봇(이루다)의 성별 고정관념 학습, 성차별 및 장애인 차별과 혐오 표현 등이 사회적 논란으로 떠오름에 따라 인공지능 기술이 산업 분야 등 다양한 영역에 적용되는 과정에서의 부작용 해소에 초점을 두고 진행됐다. 최문정 한국과학기술원 교수는 주제 발표를 통해 AI 분야의 조직문화와 전문 인력의 성별 현황, 전문 인력에 대한 윤리 정책 등을 분석해 보다 성 평등하고 윤리적인 인공지능 개발을 위한 방안을 제안했다. 최 교수는 인공지능 개발 단계에서 성별 고정관념에 따른 편향성 해소를 위해 알고리즘 편향성 검증을 위한 데이터 세트 개발, 인공지능 산업 인력의 성별 다양성을 높일 것을 강조했다. 이어지는 종합 토론에서는 연구·개발 인력의 성별 다양성 확보와 윤리 교육, 관련 기업의 조직문화 개선 등 성 평등한 인공지능 정책 추진 방안 등을 논의했다. 특히 인공지능 연구·개발·평가 각 단계에서 성인지 관점 반영 필요성과 과학기술을 인문사회학적 시각으로 볼 수 있는 융합교육의 중요성과 함께 여성과학기술인 육성 및 지원 정책 간 연계 필요성 등에 대해 의견을 나눴다. 여성가족부는 이번 토론회에서 나온 의견을 토대로 성 평등한 인공지능 정책 추진을 위한 개선과제에 대해 관련 부처 협의 및 중앙 성별영향 평가 위원회의 심의·의결을 거쳐 과학기술정보통신부 등 관련 기관에 올해 상반기 중 개선을 권고할 예정이다. 정영애 여성가족부 장관은 ""인공지능이 성인지 감수성과 윤리성 등을 충분히 담아낼 수 있도록 노력하는 것이 중요하다""라며 ""이번 토론회를 계기로 보다 성 평등한 인공지능 정책들이 정착되기를 바란다""라고 말했다. ☞공감언론 뉴시스 nowest@newsis.com ⓒ 공감언론 뉴시스통신사. 무단전재-재배포 금지"
21,http://v.media.daum.net/v/20210416100603964,"(시사저널=배윤영 호남본부 기자) 광주시와 CJ올리브네트웍스, 광주과학기술원(지스트)가 인공지능 인재 양성을 위해 손을 맞잡았다. 이번 협약은 광주시가 미래 전략산업으로 적극 추진해온 광주형 인공지능 비즈니스 기반 조성을 위한 87번째 업무협약이다. 광주시는 15일 시청 비즈니스룸에서 CJ올리브네트웍스, 지스트와 '인공지능 산업육성 및 일자리창출을 위한 업무협약'을 체결했다고 밝혔다. 이용섭 광주시장이 15일 오전 시청 비즈니스룸에서 차인혁 CJ올리브네트윅스(주) 대표, 김인수 광주과학기술원 총장 직무대행과 인공지능 산업육성 및 일자리 창출을 위한 업무협약을 체결한 후 기념촬영을 하고 있다. ⓒ광주시 CJ올리브네트웍스는 인공지능, 빅데이터, 클라우드 등 최신 ICT기술을 통해 CJ그룹의 디지털 전환을 견인하고 있다. 디지털 전환의 핵심기술인 인공지능과 블록체인 기술의 연구개발을 통해 기업 경영에 필요한 DT솔루션을 제공하고 제조·물류·유통·미디어 분야의 IT서비스를 개발하는 등 다양한 영역에 진출하고 있다. 지스트는 인공지능대학원을 신설하고 지난해부터 매년 50명 수준의 석박사 통합과정 중심의 AI인재를 양성하고 있다. 특히 실증 데이터와 SW/HW 인프라에 기반한 AI 기초 및 핵심 교육, 기술실증 및 창업지향의 현장형 연구 등을 4~5년 동안 집중적으로 경험한 실무형 인재를 양성하고 있다. 이번 협약에 따라 광주시는 인공지능산업 육성을 위한 지원프로그램, 전문인력 교육, 취업 연계 프로그램을 개발·운영한다. CJ올리브네트웍스는 AI 빅데이터 분석 등 종합IT서비스분야 기술·정책 자문 수행 및 인재육성을 하고 일자리 창출을 위해 광주소재 제2연구소를 설립한다. 지스트는 인공지능 전문인력양성 프로그램을 운영, 제공하고 국제공동연구협력 및 CJ올리브네트웍스와 함께 산학공동연구 등을 추진한다. 협약에 앞서 CJ올리브네트웍스는 광주시에서 추진하고 있는 인공지능 중심 산업융합 집적단지 조성사업에 협력하기 위해 지난해부터 지속적으로 광주시, 지스트과 인력양성, 기술정보를 교류하며 협업 가능 분야에 대해 논의해 왔다. 더불어 지스트 인공지능연구소가 주관한 2020년 AI창업 경진대회에 참여한데 이어 올해는 지스트 인공지능연구소가 진행하는 AI 디지털분야 핵심실무인재 육성사업인 K-Digital Platform 사업에 참여한다. 이용섭 시장은 ""이번 협약 체결로 CJ올리브네트웍스, 지스트가 광주의 대한민국 인공지능 산업생태계 발전에 함께 하게 되면서, 그 시너지가 일자리 창출, 소득 증가, 경제활성화로 이어질 것으로 기대한다""고 말했다. Copyright ⓒ 시사저널(http://www.sisajournal.com). 무단전재 및 재배포 금지"
22,http://v.media.daum.net/v/20210415153444090,"이용섭 광주광역시장이 15일 오전 시청 비즈니스룸에서 차인혁 CJ올리브네트윅스㈜ 대표, 김인수 광주과학기술원 총장 직무대행과 인공지능 산업육성 및 일자리 창출을 위한 업무협약을 체결한 후 기념촬영을 하고 있다. 사진=광주광역시 제공 [아시아경제 호남취재본부 박선강 기자] 광주광역시와 CJ올리브네트웍스, 광주과학기술원(지스트)가 인공지능 인재 양성을 위해 손을 맞잡았다. 이번 협약은 광주시가 미래 전략산업으로 적극 추진해온 광주형 인공지능 비즈니스 기반 조성을 위한 87번째 업무협약이다. 광주시는 15일 시청 비즈니스룸에서 CJ올리브네트웍스, 지스트와 ‘인공지능 산업육성 및 일자리창출을 위한 업무협약’을 체결했다. CJ올리브네트웍스는 인공지능, 빅데이터, 클라우드 등 최신 ICT기술을 통해 CJ그룹의 디지털 전환을 견인하고 있다. 디지털 전환의 핵심기술인 인공지능과 블록체인 기술의 연구개발을 통해 기업 경영에 필요한 DT솔루션을 제공하고 제조·물류·유통·미디어 분야의 IT서비스를 개발하는 등 다양한 영역에 진출하고 있다. 지스트는 인공지능대학원을 신설하고 지난해부터 매년 50명 수준의 석박사 통합과정 중심의 AI인재를 양성하고 있다. 특히 실증 데이터와 SW/HW 인프라에 기반한 AI 기초 및 핵심 교육, 기술실증 및 창업지향의 현장형 연구 등을 4~5년 동안 집중적으로 경험한 실무형 인재를 양성하고 있다. 이번 협약에 따라 광주시는 인공지능산업 육성을 위한 지원프로그램, 전문인력 교육, 취업 연계 프로그램을 개발·운영한다. CJ올리브네트웍스는 AI 빅데이터 분석 등 종합IT서비스분야 기술·정책 자문 수행 및 인재육성을 하고 일자리 창출을 위해 광주소재 제2연구소를 설립한다. 지스트는 인공지능 전문인력양성 프로그램을 운영, 제공하고 국제공동연구협력 및 CJ올리브네트웍스와 함께 산학공동연구 등을 추진한다. 협약에 앞서 CJ올리브네트웍스는 광주시에서 추진하고 있는 인공지능 중심 산업융합 집적단지 조성사업에 협력하기 위해 지난해부터 지속적으로 광주시, 지스트과 인력양성, 기술정보를 교류하며 협업 가능 분야에 대해 논의해 왔다. 더불어 지스트 인공지능연구소가 주관한 2020년 AI창업 경진대회에 참여한데 이어 올해는 지스트 인공지능연구소가 진행하는 AI 디지털분야 핵심실무인재 육성사업인 K-Digital Platform 사업에 참여한다. 차인혁 CJ올리브네트웍스 대표는 “인공지능을 활용한 디지털 역량이 국가 및 지역의 경쟁력인 시대에 광주시, 광주과학기술원과 협력해 지역 AI산업 육성에 동참할 수 있게 돼 기쁘다”며 “빅데이터 분석 등 회사가 보유하고 있는 DT역량을 바탕으로 인재양성을 지원하고 제2연구소 설립을 통해 광주에 거주하는 우수 인력들에게 일자리를 제공하겠다”고 약속했다. 김인수 광주과학기술원 총장 직무대행은 “이번 협약이 인공지능산업의 성공적인 발전을 위한 계기가 되길 바란다”며 “4차 산업혁명 시대를 이끌어 갈 인재 양성과 일자리 창출을 통해 지역경제 활성화가 이뤄지도록 최선을 다하겠다”고 말했다. 이용섭 시장은 “AI멘토단 운영, AI창업펀드 조성·확대, AI창업캠프 구성 등 광주시가 만들고 있는 AI고속도로가 완성되면 다양한 AI산업들이 속도를 내고 시민들이 체감하고 만족하는 양질의 AI서비스가 제공될 것이다”며 “이번 협약 체결로 CJ올리브네트웍스, 지스트가 광주의 대한민국 인공지능 산업생태계 발전에 함께 하게 되면서, 그 시너지가 일자리 창출, 소득 증가, 경제활성화로 이어질 것으로 기대한다”고 밝혔다. 호남취재본부 박선강 기자 skpark82@asiae.co.kr <ⓒ경제를 보는 눈, 세계를 보는 창 아시아경제 무단전재 배포금지>"
23,http://v.media.daum.net/v/20210414050656082,"성차별과 동성애·장애인 혐오 등 논란을 일으킨 인공지능(AI) 챗봇 ‘이루다’ 사태를 계기로 인공지능 산업에서 여성 인력의 확대가 필요하다는 주장이 나왔다. 최문정 한국과학기술원 과학기술정책대학원 교수는 13일 대전 한국과학기술원(KAIST)에서 열린 ‘인공지능(AI) 분야 양성평등 정책 확산’을 주제로 한 토론회에서 이같이 밝혔다. 여성가족부 주최로 열린 이번 토론회는 최근 AI 챗봇(이루다)의 성별 고정관념 학습, 성차별 및 장애인 차별과 혐오 표현 등이 사회적 논란으로 떠오르면서 인공지능 기술의 부작용 해소에 초점을 두고 진행됐다. 최 교수의 ‘인공지능 분야에 대한 특정 성별 영향평가’에 따르면 2019년 기준 인공지능 관련 사업체 271개에서 여성 대표자의 비율은 5.5％로 나타났다. 2018년 기준으로 소프트웨어 산업기업 2766개 중 여성 대표자는 5.0％, 여성 전문인력의 비율은 17.8％로 나타났다. 최 교수는 “인공지능 분야에서 여성이 겪는 어려움은 사실상 다른 이공계와 비슷하게 존재한다”면서 “책임 있는 인공지능과 윤리적 이슈에 대한 연구 지원 확대와 실효성 있는 인공지능 윤리교육 개발·시행이 필요하다”고 제안했다. 한국여성정책연구원 여성미래연구본부 윤형주 부연구위원도 “성평등 혁신이 과학기술계에 정착했다면 아마 이루다 사태도 막을 수 있었을 것”이라며 “인공지능 기술연구 등의 분야에서도 성평등 혁신정책을 시급히 도입해야 한다”고 주장했다. 정영애 여가부 장관은 “인공지능이 성인지 감수성과 윤리성 등을 충분히 담아낼 수 있도록 노력하는 것이 중요하다”며 “이번 토론회를 계기로 보다 성평등한 인공지능 정책들이 정착되기를 바란다”고 밝혔다. 최광숙 선임기자 bori@seoul.co.kr Copyrightsⓒ 서울신문사. 무단 전재 및 재배포 금지"
24,http://v.media.daum.net/v/20210415104512671,"【파이낸셜뉴스 무안=황태종 기자】전남도가 디지털 뉴딜의 핵심기술인 인공지능(AI)·블록체인 분야 실무 고급인재를 양성하기 위해 올해 ICT이노베이션스퀘어 교육생 모집에 들어갔다. 15일 전남도에 따르면 지난해 광주광역시, 전주시와 공동으로 컨소시엄을 구성해 과학기술정보통신부 주관 '지역 ICT이노베이션스퀘어 조성사업'의 호남권 거점 교육기관으로 선정됐다. 이에 따라 오는 2023년까지 사업비 73억 8000만원을 들여 인공지능과 블록체인 전문인력 1210명을 육성할 계획이다. 특히 지난해 과기부 운영평가 결과 우수기관으로 선정돼 국비 10억원을 추가로 확보, 인공지능 전문자격증 취득과정, AI·블록체인 강사 양성과정, 일반인을 대상으로 하는 동영상 강좌 등도 추가 운영한다. 올해 교육은 인공지능 분야와 블록체인 분야로 구분되며, 각각 비전공자를 위한 기본과정(1개월), 전공자·개발자를 위한 심화과정(1개월), 전남형 지역특화과정(2개월) 등 총 3개 과정으로 운영된다. 교육대상은 도내 기업 재직자, 대학 재학생·졸업(예정)자, 인공지능·블록체인에 관심 있는 도내 거주자 누구나 신청할 수 있다. 교육 인원은 인공지능 분야 396명, 블록체인 분야 105명 등 총 501명이다. 교육비는 전액 무료다. 한국IT서비스산업협회 누리집을 통해 온라인 및 모바일로 신청할 수 있다. 교육내용은 파이썬 프로그래밍, 딥러닝 언어교육, 인공지능 영상처리 과정, 인공지능 음성처리 과정, 블록체인의 기본 및 사례 등이다. 블루에너지, 블루트랜스포트, 농수산 등 전남도 전략사업 분야 특화 교육과정도 운영된다. 교육 방법은 코로나19 확산에 따른 사회적 거리두기 조정에 따라 상반기에는 온라인 교육, 하반기에는 광양시 커뮤니티센터 내 ICT이노베이션스퀘어 복합교육관에서 오프라인으로 실시한다. 최영주 전남도 스마트정보담당관은 ""지난해 교육 수료생 중 10명이 도내 IT 기업체와 공공기관에 취업했다""며 ""청년일자리 국비 지원사업과 연계해 도내 IT 기업과 블루이코노미 6대 분야 관련 기관의 공공일자리 참여 기회를 계속 확대하겠다""고 말했다. hwangtae@fnnews.com 황태종 기자 ⓒ 파이낸셜뉴스, 무단 전재 및 재배포 금지"
