,url,content
21,http://v.media.daum.net/v/20210326112151604,"한라대학교의 사회맞춤형산학혁명선도대학(LINC+)사업단이 서울 코엑스에서 24일부터 27일까지 열린 ‘AI(인공지능)엑스포코리아2021’에서 인공지능을 이용한 자율주행 교육용 플랫폼인 a-MAP(AI-Mobility Accelerator Program)과 교구를 선보였다. 한라대는 이번 엑스포에 대학으로선 유일하게 참가했다. 한라대 LINC+사업단이 전시회에 소개한 에이맵(a-MAP)은 인공지능 기반 자율주행 모빌리티를 쉽게 학습하고 제작하기 위한 플랫폼으로 자율주행 자동차 제작 과정을 온라인으로 학습할 수 있다. 또 주행 시뮬레이션이 가능하며 하드웨어를 직접 제작하여 실제 주행도 가능하다. 함께 출품한 교육용 플랫폼인 M-Car AI는 이미지 기반 자율주행을 위한 교육용 플랫폼이다. 실제 승용차의 8분의 1 사이즈로 구성된 모형을 통해 다양한 주행 기능을 테스트할 수 있다. 이 플랫폼은 해외 경쟁사 제품과 확장성, 성능, 가격 등 모든 분야에서 당당하게 경쟁할 수 있는 기술을 보유하고 있다. 새로 개발된 플랫폼은 한라대 스마트모빌리티 공학부와 정보통신소프트웨어학과 학생들이 신종 코로나바이러스 감염증(코로나19) 확산으로 등교를 할 수 없는 악조건에서 만들었다. 이들은 효율적인 제작을 위해 디지털트윈 기술을 활용하여 사이버 공간에서 설계와 프로그래밍을 먼저 완료한 뒤 제작에 활용했다. 한라대 링크사업단 서현곤 단장은 “스마트 모빌리티 분야 경쟁력 향상을 위한 새 교육용 플랫폼을 활용해 올해 400명 이상의 인공지능 기반 스마트 모빌리티 인재를 양성하겠다”고 밝혔다. 이번에 한라대가 참가한 AI엑스포코리아는 여러 기관과 기업들이 인공지능, 정보통신기술(ICT), 사물인터넷(IoT) 등 최신 인공지능 관련 기술과 제품을 소개하고 공유하는 전시회다. 여기에는 아이디어와 기술력을 자랑하는 다양한 인공지능과 관련된 제품들이 선보였다. 주성하 기자 zsh75@donga.com ⓒ 동아일보 & donga.com, 무단 전재 및 재배포 금지"
22,http://v.media.daum.net/v/20210325151559092,"4차 산업의 핵심인 인공지능(AI·Artificial Intelligence)은 다양한 분야와 융합하며 눈부시게 발전하고 있다. 인공지능 왓슨포온콜로지(Watson for Oncology·암 진단 및 치료를 돕는 AI 소프트웨어), 인공지능 변호사 등이 등장하며 우리 삶에 성큼 다가서고 있다. 경희대는 2022학년도에 빅데이터응용학과, 스마트팜과학과, 인공지능학과를 신설해 후마니타스(인간중심) AI 인재 양성에 나선다./경희대 제공 경희대학교(총장 한균태)가 후마니타스(인간중심) AI 인재 양성에 나선다. 대학원과 학부에 AI 관련 학과를 개설하고 ‘인공지능 브레인 허브(AI Brain Hub)’를 설치해 교육과 연구를 돕는다. 또한 인공지능 브레인 허브 산하에 ‘인공지능 클리닉 센터(AI Clinic Center)’와 ‘인공지능 데이터 센터(AI Data Center)’를 만들어 산업계와 지역사회 문제를 해결한다. 이를 위해 100억원의 예산을 투입해 발전을 도울 예정이다. 경희대의 인공지능 연구는 2017년 학부에 소프트웨어융합학과를 신설하며 첫 삽을 떴다. 2018년에는 이 학과를 컴퓨터공학과와 통합해 소프트웨어융합대학으로 승격했다. 지난해에는 일반대학원에 인공지능학과를 개설했다. 이는 2019년 AI 관련 분야의 교육 및 연구 필요성을 통감해 ‘인공지능대학원 TF’를 발족한 후 1년 만의 결실이다. 경희대 제공 2022년에는 학부에 세 개 학과를 신설한다. 경영대학 빅데이터응용학과와 생명과학대학 스마트팜과학과, 소프트웨어융합대학의 인공지능학과가 주인공이다. 이중 빅데이터응용학과와 스마트팜과학과는 AI 관련 분야 지식을 융합한 전공이다. ⓒ 조선일보 & chosun.com, 무단 전재 및 재배포 금지"
23,http://v.media.daum.net/v/20210326104440892,"[서울경제] 이스트소프트(047560) 자회사 딥아이는 인공지능(AI)와 빅데이터 기술을 적용한 안경 브랜드 ‘라운즈 앱솔루트’를 출시한다고 26일 밝혔다. 아이웨어커머스 기업 딥아이는 이스트소프트 AI 기술 연구소와 협업을 바탕으로 인공지능 기술이 접목된 아이웨어 쇼핑몰 ‘라운즈’를 운영하고 있다. 딥아이는 인공지능 기술을 통해 1만여가지 안경 형태를 분류 및 분석하고 메타데이터 처리 기술로 분석된 얼굴 유형별 선호 스타일과 유행을 조합해 각 안경 형태별 점수를 산출한 뒤 높은 점수를 받은 초기 디자인을 바탕으로 10년 이상 경력의 전문 안경사, 디자이너, 브랜드 매니저들이 최종 형태와 소재를 선정하는 개발 과정을 거쳤다. 실제 해당 제품의 디자인은 라운즈의 인공지능과 메타데이터 처리 기술, 10만 건 이상의 판매 데이터, 업계 전문가와의 협업을 바탕으로 개발됐다. 김세민 딥아이 대표는 “인공지능과 최신 기술로 그동안 축적된 사용자 피드백 등 고객 데이터를 분석한 끝에, 고객의 목소리를 반영한 프리미엄 안경 브랜드 ‘앱솔루트’를 제작할 수 있었다”고 말했다. /박호현 기자 greenlight@sedaily.com <©서울경제, 무단 전재 및 재배포 금지>"
24,http://v.media.daum.net/v/20210325163748063,"조인철 광주시 문화경제부시장이 29일 오후 시청 1층 로비에서 코로나19 확산방지를 위해 적외선 카메라와 인공지능 기반 안면인식 기술이 탑재된 AI방역로봇 시연을 참관하고 있다.(광주시 제공)2020.12.29/뉴스1 © News1 (광주=뉴스1) 박준배 기자 = 광주시는 산업통상자원부 산하 한국로봇산업진흥원이 주관하는 '2021년 로봇융합비즈니스 지원사업' 공모에 최종 선정됐다고 25일 밝혔다. 공모는 로봇융합수요 발굴 사업화로 지역로봇기업과 지역산업 동반성장을 도모하기 위해 전국 지자체를 대상으로 진행했다. 광주시는 '광주 인공지능을 활용한 로봇융합 비즈니스 사업' 과제를 제출해 선정됐다. 연말까지 국비 2억원, 지방비 2억원 등 총 4억원의 사업비를 들여 인공지능 기반의 최첨단 로봇서비스를 제공한다. 인공지능 기반 서비스로봇을 통한 출입자 발열 감지, 마스크 착용 유무 판별·알림, 챗봇서비스를 기반으로 한 민원 안내 서비스, 공기청정, 습식·건식 살균 등 방역서비스를 실시해 인공지능 기반 공공서비스를 실현하는 방식으로 진행한다. 사업 수행은 (재)광주테크노파크 생활지원로봇센터에서 맡는다. 기존 인프라를 활용해 인공지능 기반 서비스로봇의 안전성, 신뢰성, 유효성 검증 등 시험평가와 실증테스트를 지원하고 로봇 제품의 상용화를 앞당길 계획이다. 기업은 지역 인공지능 전문기업인 ㈜넷온과 ㈜제타뱅크 등이 참여한다. 이들 기업은 컨소시엄을 구성해 인공지능 기반 안내서비스로봇과 자율방역서비스로봇을 개발해 시민을 대상으로 서비스를 제공한다. 국내 인공지능 플랫폼 중 가장 성능이 뛰어난 네이버 '클로바' 플랫폼을 기반으로 최신 머신러닝 기술을 적용한 안내서비스로봇을 개발해 사용자의 질의에 대한 최적의 응답서비스와 완성도 높은 챗봇서비스를 제공한다. 손경종 시 인공지능산업국장은 ""로봇산업은 인공지능 기술의 총아""라며 ""인공지능 중심도시 광주에서 우수 기술의 창업 스타트업과 기술사업화 등 맞춤형 성장지원으로 지역로봇산업 육성과 시장을 창출하고 국비사업 발굴 등을 전략적으로 추진해 지역경제 활성화를 꾀하겠다""고 말했다. nofatejb@news1.kr Copyright ⓒ 뉴스1코리아 www.news1.kr 무단복제 및 전재 – 재배포금지"
25,http://v.media.daum.net/v/20210324172702281,"전년도 AI EXPO KOREA 2021 행사전경 전대미문의 펜데믹 속에서 인공지능은 단 수주만에 '코로나19 진단 키트' 개발하고 정확성이 혁신적으로 향상된 AI 진단 알고리즘은 불과 수초만에 감염여부를 판별하고 백신 후보물질과 치료제 개발까지 최전선에 나서고 있다. 또한 AI 얼굴인식 및 열화상인식 시스템, AI 화상회의 및 교육 솔루션, 유통, 물류 등 비대면 언텍트 시대에서 인공지능은 다양한 장소와 지역에서 눈부시게 활약하고 있다. 올해로 4회째를 맞는 ‘국제인공지능대전(AI EXPO KOREA 2021)’이 사회적 거리 두기 캠페인에 동참하고 참가사와 참관객의 안전에 최선을 두고 철저한 방역 지침과 현장 대응 매뉴얼을 마련하고 3월 24일(수)부터 26일(금)까지 사흘간 서울 삼성동 코엑스에서 개최된다. 이번 AI EXPO KOREA 2021에서는 인공지능(AI)이 미래가 우리에게 어떤 의미가 될 것인지 AI가 가져오는 우리 사회와 산업의 혁신은 무엇인지 관련 AI 최신 기술과 플랫폼·솔루션, AI 기반 비즈니스 모델, 국내외 AI 기업의 비즈니스 전략, 적용 및 도입 전략 등 4차 산업혁명 시대를 혁신으로 이끌 인공지능(AI)의 모든 것을 한눈에 확인하고 공유하고 네트워킹 할 수 있는 장이 사흘간 펼쳐진다. 이번 국제인공지능대전2021은 네이버클라우드, 한국마이크로소프트, 메가존클라우드, 에이모, 크라우드웍스, 인피닉 등 AI 전문기업 150여개사와 기관의 참가해 215부스 규모로 한국인공지능협회(회장 김현철), 서울메쎄인터내셔널(대표 박병호), 인공지능신문 등 3개 기관이 과학기술정보통신부(장관 최기영), 한국지능정보사회진흥원(NIA), ETRI 등의 후원으로 통합 주최·주관한다. 특히, 인공지능이 언텍트 시대를 맞는 우리 사회와 기업과 산업이 대응해 나가고 인공지능을 통해 ​​교육과 생산, 유통, 물류, 비즈니스 등의 환경을 어떻게 구축해야 하는지와 제품의 시장 경쟁력과 기회를 창출하기 위한 제품의 차별화와 비용 효율적인 성능을 개선하고 생산성을 높이고 수익을 얻을 수 있는 ‘AI언텍트관’을 추가로 설치해 그 대응 방향과 구현 전략을 제시한다. 주요 출품 및 전시품목으로는 ▷‘AI언텍트’관에서는 AI 화상솔루션, 교육 솔루션, 비대면 입출입 기기 및 장비, 키오스크, 감지 및 식별 시스템, 금융, 유통 물류 등의 각종 솔루션과 기기를 참관하고 직접 시연할 수 있다. ▷‘AI Elemental Technologies·H/W·S/W’ 분야의 머신러닝, 딥러닝, 뉴럴 네트워크, 강화학습, 자연어, 음성인식, 이미지인식, AI칩·부품, 컴퓨팅, 클라우드, 데이터센터, 딥서버, 플랫폼·솔루션 등을 전시 및 시연한다. ▷‘AI Applications & Services’ 분야로 챗봇 및 어시트턴트, RPA, 5G·네트워크, IoT, 자율주행, 의료·헬스케어, 금융, 보안, 제조·유통·소매, AI로봇, 머신러닝, 웨어러블, 스마트팩토리, 스마트시티·홈, 드론·UAV, AI콜센터(컨텍센터), 예측유지보수, AI컨설팅 등을 직접 체험하고 관련 인사이트를 공유한다. 부대행사로는 AI 융합 비즈니스 개발 컨퍼런스 2021, AI EXPO KOREA SUMMIT, 참가기업 AI 기술 & 솔루션 발표 세미나, ‘인공지능 시대와 메타버스 세상에서의 에듀테크 정책과 방향을 읽다'의 주제로 에듀클라우드 파트너스 데이 2021, ’스마트카와 AI의 융합이 가져올 미래‘의 주제로 2021 스마트카미래포럼 등이 열린다. 특히, 전시기간 중 24개 국내 AI 스타트업이참가하는 인공지능 기업의 투자매칭 IR대회 ’AI Rocket Launcher Day Season. 1‘개최된다. 한편, 이번 국제인공지능대전은 직접 전시회장을 방문하지 못하는 바이어와 참가업체의 원격상담을 지원 시스템을 구축하는 등 한국 전시업계 새로운 출발을 위한 노력을 하고 있으며, 참관객 역시 전시장 입구에 마련된 비대면 등록 시스템 및 사전 배부된 모바일 초청장으로 철저한 방역 지침 속에 진행된다. 전자신문인터넷 유은정 기자 (judy6956@etnews.com) Copyright ⓒ 전자신문 & 전자신문인터넷, 무단전재 및 재배포 금지"
26,http://v.media.daum.net/v/20210324130923065,"(서울=뉴스1) 김진환 기자 = 24일 오후 서울 강남구 코엑스에서 열린 제4회 국제인공지능대전 (AI EXPO KOREA 2021)에서 AI 업체 직원이 시연을 하고 있다. 오는 26일까지 열리는 ‘국제인공지능대전(AI EXPO KOREA 2021)’는 인공지능(AI)이 미래가 우리에게 어떤 의미가 될 것인지 AI가 가져오는 우리 사회와 산업의 혁신은 무엇인지 관련 AI 최신 기술과 플랫폼·솔루션, AI 기반 비즈니스 모델, 국내외 AI 기업의 비즈니스 전략, 적용 및 도입 전략 등 4차 산업혁명 시대를 혁신으로 이끌 인공지능(AI)의 모든 것을 한눈에 확인하고 공유하고 네트워킹할 수 있는 장이 사흘간 펼쳐진다. 2021.3.24/뉴스1 kwangshinQQ@news1.kr Copyright ⓒ 뉴스1코리아 www.news1.kr 무단복제 및 전재 – 재배포금지"
27,http://v.media.daum.net/v/20210326110203640,"사진은 인공지능 캔·페트병 무인회수기 ‘네프론’ 4호의 설치된 모습이다. / 사진제공=강동구 서울 강동구는 스마트재활용 수거체계를 구축하기 위해 강동구민회관 정문 앞에 순환자원 회수로봇(네프론) 4호를 설치·운영한다. 인공지능 캔·페트병 무인회수기(네프론)는 캔이나 페트병을 투입구에 넣으면 인공지능 센서가 캔과 페트병을 자동으로 분류‧압착하여 수거하는 인공지능(AI)과 사물인터넷(IoT) 기술을 적용한 자판기 형태의 자원순환 로봇이다. 수거에 대한 보상으로는 캔·페트병 개당 10원의 포인트로 적립되고 일일 최대 1인당 200개까지 투입할 수 있다. 누적 포인트가 2000점 이상 적립되면 수퍼빈 홈페이지 또는 수퍼빈 앱(애플리케이션)을 통해 개인 계좌로 이체되어 현금으로 사용할 수 있다. 앞서 강동구는 성일초등학교에 네프론 1호를 시범시작으로 샘터근린공원에 네프론 2호, 암사동 유적에 네프론 3호를 설치하여 운영하고 있다. 2021년 2월 누적 이용자 수는 5100여 명에 이르며 적립된 누적 포인트는 220만원을 넘어섰다. 30만 개가 넘는 캔과 페트병이 재활용되어 자원 선순환에 일조하였다. 이에, 구는 자원 선순환에 대한 인식을 더욱 개선하고자 강동구민회관에 네프론 4호를 설치하였다. 이정훈 강동구청장은 “코로나19로 강동구민회관이 현재 휴관이지만 지역 주민이 이용할 수 있고, 향후 구민회관 방문객 등 많은 주민이 네프론을 이용할 것으로 기대된다”며 “앞으로도 자원 선순환의 중요성을 인식하고 동참할 수 있도록 최선을 다하겠다”고 말했다. 김경석 기자 84kskim@mt.co.kr 저작권자 ⓒ '성공을 꿈꾸는 사람들의 경제 뉴스' 머니S, 무단전재 및 재배포 금지"
